{
  "schema_version": "fabricctl.signed-connection-receipt/v1",
  "key_id": "management-key-2026-01",
  "receipt": {
    "schema_version": "fabricctl.connection-receipt/v1",
    "connection_id": "connection-01",
    "mode": "singleaxis-private",
    "endpoint_origin": "https://management.example.com",
    "tenant_ref": "tenant/acme",
    "workload_ref": "system:serviceaccount:fabric-system:fabric-site",
    "effective_digest": "sha256:cccccccccccccccccccccccccccccccccccccccccccccccccccccccccccccccc",
    "connected_at": "2026-08-28T10:10:00Z",
    "credential_stored": false
  },
  "signature": "AAAAAAAAAAAAAAAAAAAAAAAAAAAAAAAAAAAAAAAAAAAAAAAAAAAAAAAAAAAAAAAAAAAAAAAAAAAAAAAAAAAAAA"
}
